{
  "artifact": {
    "id": "ticket-bundle-fast-001",
    "version": 1,
    "source_stage": "ticketing",
    "next_stage": "build",
    "status": "ready",
    "risk_tier": "low",
    "execution_lane": "fast",
    "owner_agent": "Ticket Architect",
    "policy_decision_id": "policy-fast-001",
    "budget_class": "small",
    "rollback_class": "immediate_flag_disable",
    "approval_requirements": [],
    "created_at": "2026-04-22T13:00:00Z",
    "updated_at": "2026-04-22T13:00:00Z"
  },
  "spec_packet_id": "spec-fast-001",
  "eval_manifest_id": "eval-fast-001",
  "tickets": [
    {
      "id": "ticket-fast-001",
      "title": "Add backend response format tool mode support",
      "kind": "backend",
      "summary": "Expose the new response format tool mode behind an internal feature flag.",
      "scope": [
        "Add route support",
        "Add types",
        "Add integration coverage"
      ],
      "definition_of_done": [
        "Internal callers can enable the new mode.",
        "Tests cover success and rollback behavior."
      ],
      "known_edge_cases": [
        "Invalid tool mode value should return a contract error."
      ],
      "non_goals": [
        "No external SDK exposure yet."
      ],
      "eta_days": 1,
      "risk_tier": "low",
      "execution_lane": "fast",
      "required_eval_tiers": [
        "pr_smoke",
        "pre_merge"
      ],
      "allowed_tools": [
        "git",
        "python",
        "pytest"
      ],
      "secret_scope": "none",
      "rollback_strategy": "Disable the feature flag and redeploy if needed.",
      "acceptance_criteria_refs": [
        "ac-fast-001"
      ]
    }
  ],
  "dependency_graph": [],
  "budget_summary": {
    "total_token_budget_usd": 20
  }
}
